komentar,tfidf_positif,tfidf_negatif,sentimen
"Tolong pemesanan gofoodnya di perbaiki, total pemesanan sudah ditambahkan dengan biaya ongkir lalu di kasih diskon lalu ditambah biaya onkir lagi. Jadi dalam setiap pemesanan gofood 2 kali bayar ongkir, fatal banget mnrutku. Tolong di perbaiki.",872.3611818364,809.2874674923,negatif
"Ada voucher goride potongan maks.7k tapi ga bisa dipakai padahal udah klik pakai baik pembayan tunai,gopay,l dan gopaylater semuanya ga ada yg kepotong.... ampun ini knp gw kira minta update jd gw update. Ga taunya sama aja.. ini knp?",800.2567590477,861.1477987991,negatif
"Saya kasih satu ya. Upgrade gopay susah banget ! Sudah kirim KTP sampai 4.kali dan foto selfi KTP masih ditolak terus. Uang saya tertahan di gopay tidak bisa tarik. Alasannya macam2. iD tidak dipoto langsung dari kamera, padahal poto sudah langsung dari kamera, karena memang ga ada pilihan ambil pot...Ulasan LengkapSaya kasih satu ya. Upgrade gopay susah banget ! Sudah kirim KTP sampai 4.kali dan foto selfi KTP masih ditolak terus. Uang saya tertahan di gopay tidak bisa tarik. Alasannya macam2. iD tidak dipoto langsung dari kamera, padahal poto sudah langsung dari kamera, karena memang ga ada pilihan ambil poto dari galeri. Terakhir alasannya poto terlalu terang. Anehhhhhhh.... Tolong tingkatkan dulu servicenya.",7204.4481458859,5342.791314822,negatif
"Heran , ko skrg pesen goride jadi susah ya padahal ada keperluan penting tolong dong perbaiki jgn kaya gini jadi sulit ini gojek padahal saya tinggal di kota tapi ko ngga ada 1 pun yg nerima pesanan zzzz perbaiki lagi lah .",1269.3478464691,1391.3010782517,negatif
"Sayang skali untuk promo gofood nya kurang kalah sama aplikasi sebelah walaupun agak mahal tpi banyak promonya,,selain itu sistem keamanannya jg masih lemah perlu banyak yg harus di rubah Kecewa sama gojek akhirnya di uninstall dan beralih ke aplikasi sebelah",915.1982356166,1210.1445821003,negatif
"Voucher sering tidak berlaku. Padahal saat order makanan itu voucher bisa tp saat makanan datang kok vouchernya hilang tiba"", padahal diresto tidak ada perubahan harga makanan. Jadi harus bayar makanan penuh tanpa potongan voucher. Gojek emg gak bisa konsisten dlm hal promo, beda jauh sama grab yg b...Ulasan LengkapVoucher sering tidak berlaku. Padahal saat order makanan itu voucher bisa tp saat makanan datang kok vouchernya hilang tiba"", padahal diresto tidak ada perubahan harga makanan. Jadi harus bayar makanan penuh tanpa potongan voucher. Gojek emg gak bisa konsisten dlm hal promo, beda jauh sama grab yg blm pernah mengecewakan.",5644.3405391917,6820.5142528284,negatif
"Driver nya ga ramah, jangankan ramah, si drivernya enggak tau titiknya sibdrivernya juga yg marah2. Mana dateng2 bawa orang (bapak2 pakai jaket grab) kaya mau ngajakin berantem. Paraaahhhh niatnya mau kasih tips jd males, bukan cuma sama drivernya doang tapi aplikasi gojeknya juga. Masa ga bisa sele...Ulasan LengkapDriver nya ga ramah, jangankan ramah, si drivernya enggak tau titiknya sibdrivernya juga yg marah2. Mana dateng2 bawa orang (bapak2 pakai jaket grab) kaya mau ngajakin berantem. Paraaahhhh niatnya mau kasih tips jd males, bukan cuma sama drivernya doang tapi aplikasi gojeknya juga. Masa ga bisa seleksi buat yg mau jd driver ??",4164.1227941403,5140.5700695683,negatif
Mau upgrade gak bisa bisa. Tolong dong benerin!!!!! Sebel deh aneh balik mulu keluar mulu gak jelas... Berpuluh-puluh kali. Benerin donggg nanti saya ganti bintang 5,622.3857206099,566.8922334488,negatif
saldo gopay sering tidak masuk. di history mobile bangking sudah jelas ada. sudah berulang kali seperti ini. kinerja gojek makin buruk!!! dan sangat merugikan waktu dan konsumen! Makin parah.,343.3511792373,351.4833864787,negatif
"Go-jek tidak jelas.,masa saya diwajibkan bayar tagihan yg saya sendiri tidak pernah melakukan transaksi apapun di paylater..klh tagihan Rp.40.000..maaf saya merasa terganggu atas hal ini..mohon ditinjau kembali.",359.552917606,495.1089958231,negatif
"Sering kesel klo ada driver nya yg ga tau jalan sering nyolot dan ga berusaha nyari, kadang kita yg harus nelpon dia berulang kali, kadang driver nya suka main oper ke temen nya yg lain tanpa pemberitahuan. Ok gitu aja makasih",1165.3093121407,1217.6732664963,negatif
"Ada apa dengan gojek. Bagaimana bisa nomor hp terdaftar saya di akun gojek, ada di tangan penipu yg mengaku dari gojek? Penipu berniat mengambil alih dana saya di salah satu rekening bank milik saya dengan mencoba mengaktifkan rekening phonecell dari hp penipu. Segera gojek memikirkan hal ini untuk ...Ulasan LengkapAda apa dengan gojek. Bagaimana bisa nomor hp terdaftar saya di akun gojek, ada di tangan penipu yg mengaku dari gojek? Penipu berniat mengambil alih dana saya di salah satu rekening bank milik saya dengan mencoba mengaktifkan rekening phonecell dari hp penipu. Segera gojek memikirkan hal ini untuk kebaikan.",5403.5956474672,8932.4803858153,negatif
"Alamat tidak keluar dan tidak bisa di klik, entah kenapa..hanya muncul ""masukkan alamatnya disini"" dan tulisan berulang ""server kami padat merayap"" padahal di hp teman saya normal aja",318.8456953193,621.232098059,negatif
Hari tanggal 8 desember 2019 ada yg telp ke hp saya. Dan blg klo saya dapat hadiah undian dari PT. GOJEK senilai 2 juta. Saya tau klo ini penipuan. Cuman yg saya herankan kenapa kok orgnya bisa tau saya punya akun gojek. Apa data pribadi akun gojek saya ini gak terprivasi ya???,830.8347490531,1475.7577446314,negatif
"Kenapa akun saya dibekukann????????????? Gara2 cancel terus,saya cancel juga gara2 drivernya gabisaaa karena drivernyaa gaada uang buat beli makanan sampe 7x saya pesen gaada yg bisaa,teruss kenapa akun saya dibekukannnnnn?????",227.9233992448,341.2288437411,negatif
"Gojek tak lagi membantu tapi membuntu, memaksa orang untuk membeli makanan mahal untuk mendapat diskon. Diskon yang lama mana? Apa udah siap ratting turun? Gak takut kalah saing sama ojol sebelah? Udah merasa hebat? RIP Gojek yang hilang.",1231.2463236812,1740.6088069451,negatif
"Kok gojek sekarang jadi penipuan iya, dgn iming"" mau ngasih hadian tahun baru, bakal dapat 2000.000 jt tp saya harus isi salodo gopay eh ternyata, akun gojek yg saya punya di hak sama si penipu dan uang gopay yg saya isi 200.000 ribu hilang gtu aja, katanya uang 200.000 rb ini buat ngaktifin biar bi...Ulasan LengkapKok gojek sekarang jadi penipuan iya, dgn iming"" mau ngasih hadian tahun baru, bakal dapat 2000.000 jt tp saya harus isi salodo gopay eh ternyata, akun gojek yg saya punya di hak sama si penipu dan uang gopay yg saya isi 200.000 ribu hilang gtu aja, katanya uang 200.000 rb ini buat ngaktifin biar bisa uang nya di ambil ternyata malah kita dapat tagihan 2000.000 bukan nya dapat tp malah d suruh bayar enak bgt iya udh nipu minta bayar lagi, emang bangsat tuh penipu, mulai sekarang unistal GOJEK ğŸ˜ ",13638.9937612957,16237.4774583856,negatif
"Saya mengaktifkan gofood plus, tpi saat saya memesan gofood tidak terpotong diskon apa"" . Tolong pihak gojek perbaiki ini, karena uang saya sdh terpotong untuk mengaktifkan gofood plus tpi saya tidak mendapat diskon. Saya merasa dirugikan",380.4248171567,457.6274963767,negatif
"First time ngasih penilaian pada aplikasi. Karena memang aplikasi ini begitu buruknya. Terima kasih gojek, berkat kamu saya pindah ke grab. Semoga semakin banyak pengguna gojek yg pindah ke grab. Karena di gojek, saldo gopay saya sering hilang sendiri, gak banyak si, kadang 5k, 10k. Tapi tiap ada sa...Ulasan LengkapFirst time ngasih penilaian pada aplikasi. Karena memang aplikasi ini begitu buruknya. Terima kasih gojek, berkat kamu saya pindah ke grab. Semoga semakin banyak pengguna gojek yg pindah ke grab. Karena di gojek, saldo gopay saya sering hilang sendiri, gak banyak si, kadang 5k, 10k. Tapi tiap ada saldo sisa pasti hilang. Dan ini mau upgrade jg adaaa ajaaa alasan.nya. sampe udah foto hampir 50x. Tetep gak bisa. Katanya ktp gak bisa digunakan, foto gak pake kamera sendiri. Lah maksud.mu?",8893.2445137303,8558.7837216167,negatif
"Tolong di respon secepatnya! Beli paket data di bimatri pake gopay, paket datanya belum masuk tapi gopay sudah terpotong. Sudah coba email kedua pihak tapi belum ada respon. Gimana nih?",196.8723031075,443.7106379984,negatif
Sangat bagus aplikasinya. Saya suka. Apalagi banyak vocer diskon nya. Sangat membantu. Semoga sukses selalu,81.2949800712,49.9944398346,positif
"Saya sering pesen goride, pake voucher, di cancel terus sampe 4 kali, terus pas enggak pke voucher, baru ada yg ambil, dn driver yg ambil itu yg tadi cancel orderan saya pas saya pake voucher. Sebener nya tuh kalo pke voucher ada dampak negativ apa sih ke driver nya?",1230.0483034141,1217.4357965351,positif
"Saya sering menggunakan gojek, karena saat ada kebutuhan transportasi mendadak, gojek selalu ada untuk membantu saya, terimakasih:)",49.9271344558,72.0733385475,positif
"Rata rata driver gojek ramah , dan saya selalu memberi bintang sesuai apa yang mereka berikan KPD saya. Terimakasih gojek sudah memberikan peluang kerja juga buat calon suamiku yg sedang berusaha menghalauku , hehe #2021 aamiin",753.4793528696,601.9586160133,positif
I love produk indonesia...Tapi kalo bisa di perbaiki data base pencarian tempat/data base lokasi dan GPS msh kurang,164.4897513795,273.5402186198,positif
"Tolong dong ada penilaian buat resto nya biar bisa pake gambar atau foto,. Kesel berkali kali gk ada lauknya atau adts yg lupa",252.2133267568,295.224675811,positif
Mantap Tp akan lebih mantap lagi kalau ada go market.....jadi kita ibuk2 yg jauh dari pasar atau supermarket bisa belanja lewat GOJEK.....sukses selalu.,330.2491168927,333.0322717779,positif
"Memudahkan dalam segala hal, kebutuhan rumah tangga, transfortasi dll semua ada di gojek, mantap dan luar biasa",258.0641279793,191.7365963236,positif
"Aplikasi nya sudah bagus sekali, setiap pesan goride langsung dapat driver dan cepat datang ke rumah. Tolong saja banyakin promo-promo menarik lainnya.",285.1507065591,288.9774153994,positif
"mantap aplikasi ini sangat membantu saya dalam melakukan transaksi. tapi ada kekurangan sedikit mengenai top up saldo khusus customer. saran saya jangan ditentukanlah nominal top upnya, berilah kebebasan buat customer mau top up berapa saja",1173.6860914886,1515.3177830769,positif
"Maaf sebelumnya jika saya memberikan komentar ini dikarena saya merasa kenapa aplikasi ini tidak bisa membatalkan pesanan gojek/gocar secara langsung. Krn harus menconteng berbagai macam alasan & apapun yg saya pilih selalu saya mendapatkan kemarahan dari gocar atau gojek bersangkutan. Sampai kata k...Ulasan LengkapMaaf sebelumnya jika saya memberikan komentar ini dikarena saya merasa kenapa aplikasi ini tidak bisa membatalkan pesanan gojek/gocar secara langsung. Krn harus menconteng berbagai macam alasan & apapun yg saya pilih selalu saya mendapatkan kemarahan dari gocar atau gojek bersangkutan. Sampai kata kata kasar yg saya terima. Apakah salah jika saya membatalkan pesan dkarenakan saya mendadak sakit,mendadak membatalkan rute perjalanan,atau keadaan seperti ketidak tauan mereka membuat saya menunggu.",8651.6395343412,10883.8981953479,positif
"Aplikasinya sangat jelas, mudah penggunaannya dan praktis. Ayo teman2 semua segera download aplikasi gojek karena banyak keuntunganya bagi para penggunanya.",199.5327685955,279.2944370851,positif
"Sangat membantu, terutama buat anak kosan yg laper tengah malem trus mager kuar. Thankyou so much. Dan waktu otw krja waktu udah mepet gada kendaraan umum yaa pake go ride. Kebetulan lagi banyak promo juga",929.5142265502,1032.0419821855,positif
Terimakasih atas admin aplikasi gojek . Dengan ini saya tidak terlambat lagi kesekolah .ğŸ‘ Kalo mau nyari ojek pangkalan mah .lambat banget . Pas gak ada .malah gak bisa pergi sekolah .,609.6433982928,657.0897815411,positif
"Untuk memenuhi kebutuhan,transportasi,pengiriman doc/barang,makanan tinggal klik semua terpenuhi tanpa acara ribet dan lelet",108.4159261779,199.9730311299,positif
"Kenapa Gopay PayLater saya tidak dapat, padahal saya driver juga.. Temen2 driver lain yg baru jadi driver sudah bisa gunakan PayLater.. ???",163.5327652263,155.8086731905,positif
"Sangat menguntungkan bagi masyarakat, dan dapat mengurangi macet dimana saya biasanya naik kendraan sendiri kalau sekarang suka naik kendraan umum",230.713140395,479.0095218239,positif
"Mantap mamang,,, apk ini sangat memudahkan segala urusan saya, seperti kelaparan, kehabisan pulsa, kuota, vocer game, dan lainnya, transportasi sih udah pasti. Yang paling penting bantuan nya cepat sekali, Akun saya hampir hilang beberapa jam yg lalu, tapi atas bantuan CS sekarang akun nya sudah ama...Ulasan LengkapMantap mamang,,, apk ini sangat memudahkan segala urusan saya, seperti kelaparan, kehabisan pulsa, kuota, vocer game, dan lainnya, transportasi sih udah pasti. Yang paling penting bantuan nya cepat sekali, Akun saya hampir hilang beberapa jam yg lalu, tapi atas bantuan CS sekarang akun nya sudah aman lagi di tangan saya. Thanks GO-JEK.",8795.901645772,8455.8390415784,positif
"Sangat Bagus, Memuaskan, Saya Sangat Berlangganan Di GO-PAY, Khususnya Top Up Game, Tapi Saya Memohon Untuk Menambahkan 1 Game Lagi Di Via Top Up GO-PAY, Game Dragon Nest M, Di Tunggu Update Nya Min, Pelase, Ini Saya Tunggu â˜º",0,354.8120713914,positif
Aplikasi ini sangat membantu saya dan banyak promonya drivernya jga ramah tapi ada yg sambil ngerokok jadi gk enakkan klo minta dimatiin tolong diperhatikan.,264.1128740719,450.8146119316,positif
"Aplikasinya banyak promo, murah saldo go paynya dan gampang isi saldonya juga.. Saya sangat senang perusahaan rancangan generasi bangsa ini memberikan dampak positif kepada seluruh rakyat Indonesia salah satunya yaitu menginspirasi anak muda untuk berkarya untuk kemajuan bangsa Indonesia menjadi leb...Ulasan LengkapAplikasinya banyak promo, murah saldo go paynya dan gampang isi saldonya juga.. Saya sangat senang perusahaan rancangan generasi bangsa ini memberikan dampak positif kepada seluruh rakyat Indonesia salah satunya yaitu menginspirasi anak muda untuk berkarya untuk kemajuan bangsa Indonesia menjadi lebih baik.. Semoga Gojek akan menjadi Perusahaan Raksasa skala Indonesia dan Internasional.. Aamiin",6922.2209884593,7602.3952697799,positif
Sangat membantu buat customer... Buat para pengguna gojek yang akunnya dibekukan itu karna kesalahan anda sendiri... Karna para driverpun bisa memberi reting penilayan kepada custemer.. Jika anda judes. Pelit. Rese. Suka mampir2 tp ga ngasih tip.suka ngatur jalan. Dan sebagainya..driver pun bisa nga...Ulasan LengkapSangat membantu buat customer... Buat para pengguna gojek yang akunnya dibekukan itu karna kesalahan anda sendiri... Karna para driverpun bisa memberi reting penilayan kepada custemer.. Jika anda judes. Pelit. Rese. Suka mampir2 tp ga ngasih tip.suka ngatur jalan. Dan sebagainya..driver pun bisa ngasih anda bintang 1.. Dan anda pun bisa d bekukan akunnya... Mangkanya jangan asal kasih reting... Kita smua sma2 membutuhkan.. Jgn mau menang sendiri atau merasa paling benar..ğŸ˜Š,9153.3966230878,11369.6951267626,positif
"Asyiikk byr pakai gopay, praktis, dan bnyak vouchernya, aplg voucher blj d alfamart, dpt hrga diskon pula, krn ad gopay hajatan. Dgn gopay bs pesen go food favorit q. Duh senengane.Trmksh gopay. Love you.",579.1592437822,432.8131063996,positif
"Sudah oke. Tinggal pengembangan. Untuk promo jangan tanggung, kasih yang terbaik apalagi promo go food dan go ride. Selamat bertugas.",384.6914589815,167.5380023516,positif
"Mohon diberi sanksi untuk driver yang milih2 jarak dan penumpang Kalau memang ga mau narik cancel aja, jadi kita tidak menunggu terlalu lama, jangan nunggu penumpang yang cancel",578.8769209408,550.9396745732,positif
"Pengalaman saya pakai app gojek sangat membantu sekali , semoga gojek akan segera ada di Kota Manis Pangkalan Bun, Kalimantan Tengah agar masyarakat di sini bisa menggunakan layanan transportasi dan delivery yang aman dan terjangkau ğŸ¥°ğŸ¥°ğŸ¥°ğŸ¥°ğŸ¥°ğŸ¥°ğŸ¥° Ditunggu kedatangannya gojek ğŸ˜ğŸ˜ğŸ˜",772.7202773392,1068.1488492026,positif
"Makin siippp lah daripada apl sebelah. Apl sebelah makin update makin gede makin bikin lemot.. Driver2 nya juga lebih ramah2 sini dari pada sebelah, pdhl harga jauh lebih murah sini daripada sana, tp sebelah driver2 nya kurang ajar semua. NB: harga nya terlalu murah kasian drivernya, kalo bisa di na...Ulasan LengkapMakin siippp lah daripada apl sebelah. Apl sebelah makin update makin gede makin bikin lemot.. Driver2 nya juga lebih ramah2 sini dari pada sebelah, pdhl harga jauh lebih murah sini daripada sana, tp sebelah driver2 nya kurang ajar semua. NB: harga nya terlalu murah kasian drivernya, kalo bisa di naikan dikit lah no problem kok kami penumpang.. Thanx...",10017.212740223,14765.3730618328,positif
"Bersama Gojek, hidup menjadi lebih mudah, indah, barokah, bisa bersedekah, menelan ludah, dapat hadiah, dan memberi nafkah. Mudah, karena semua yang dibutuhkan tersedia. Indah, karena bisa hemat waktu, tenaga, dan biaya. Barokah, karena ada misi sosial buat yang membutuhkan. Bisa bersedekah, karena ...Ulasan LengkapBersama Gojek, hidup menjadi lebih mudah, indah, barokah, bisa bersedekah, menelan ludah, dapat hadiah, dan memberi nafkah. Mudah, karena semua yang dibutuhkan tersedia. Indah, karena bisa hemat waktu, tenaga, dan biaya. Barokah, karena ada misi sosial buat yang membutuhkan. Bisa bersedekah, karena ada bisa berniat memberi tip, dan bantuan lainnya. Menelan ludah, karena melihat menu lezat. Memberi nafkah, karena banyak para pencari nafkah terbantu. Keren!!!",6015.1760434772,9897.1898044241,positif
"Kisah hari ini,,, kisah pilu aq di tgl tua, mendadak ga ada kendaraan dirumah, mau pergi ada urusan bingung, Alhamdulillah dgn ada nya gojek memudahkan sy untuk pergi kemana az dgn keadaan kantong yg ngepasÂ²an, walau dpt promo ttp az ga tega ngasih jasa trip nya ke driver, sy tambahin sedikit, tp se...Ulasan LengkapKisah hari ini,,, kisah pilu aq di tgl tua, mendadak ga ada kendaraan dirumah, mau pergi ada urusan bingung, Alhamdulillah dgn ada nya gojek memudahkan sy untuk pergi kemana az dgn keadaan kantong yg ngepasÂ²an, walau dpt promo ttp az ga tega ngasih jasa trip nya ke driver, sy tambahin sedikit, tp setidaknya ini sudah sangat membantu sy yg ditanggung bulan begini. Sukses Go-Jek... Dan semoga para drivernya Jujur & amanah.",9089.711353667,10653.9404663602,positif
"Terima kasih gojek sejak ada PAYLATER pas malem malem jam 12 lagi laper, pesan gofood eeh...saldo gopay tiris, malah lupa ambil uang di atm, tertolong dengan PAYLATER deh senengğŸ˜ŠğŸ¥° thanks gojek",483.3154668805,640.7626095845,positif
Untuk pihak gojek tolong lebih bisa menyaring lg untuk penggunaan nomer yg didaftarkan ke aplikasi penumpang. untuk nomer luar negri sebaiknya tidak usah di acc karena sangat merugikan driver dan aplikator .. thanks semoga ulasan ini sampai,649.7900965943,894.1052315857,positif
"Karena mereka Saya jadi bisa ketempat-tempat tujuan dengan mudah dan cepat, pokoknya pelayanan nya bagus dechğŸ‘, keren dan tingkatkan lagi",294.4312483465,225.0950857465,positif
"Tolong dong kok aplikasi gojek saya kagak bisa digunain,, udah diperbaruin tapi mesen gofood kok ngak bisa infonya""""permintaan anda ditolak """" Tolong yah udah 2 hari ngak bisa digunain",426.4547186351,824.4679734854,positif
Tolong untuk gojek ditambahkan foto agar tidak miskomunikasi masalah alamat. Kalo ada foto kan enak saya disini ada fotonya. Terimakasih,232.2706751473,324.736411938,positif
"Saya mau tanya nih, kan saya pesen makanan pertama itu dpet Driver deket gitu dri tujuan. Tpi kok gk selang lama driver nya tiba"" ganti sendiri, trus saya dpat driver baru, eh Driver nya malah ada di Bali padahal lokasi saya ada di Surabaya. Kok aneh, kok bisa gitu ya?. saya jadi resah kalau mau pes...Ulasan LengkapSaya mau tanya nih, kan saya pesen makanan pertama itu dpet Driver deket gitu dri tujuan. Tpi kok gk selang lama driver nya tiba"" ganti sendiri, trus saya dpat driver baru, eh Driver nya malah ada di Bali padahal lokasi saya ada di Surabaya. Kok aneh, kok bisa gitu ya?. saya jadi resah kalau mau pesen lagi. Mohon perbaikan nya",6703.7594508712,9341.3179619026,positif
"Selama ini ckup memuaskan,suka sama promonya yg di berikan khusus (gk pake rebutan) Cuma kadang masih suka kesel sama driver ( go food) yg klu misal gk mau ambil pesenan gk mau info ke customer,di diemiiiinn ajh ... Dh sering dapet yg kyk gtuğŸ™„",1295.8753416804,1414.2221657363,positif
"Min tolong tambahin fitur untuk donasi buat ""GAZA"" agar kita bisa memberikan sedikit dari penghasilan untuk saudara kita disana",212.3156972553,255.5996803722,positif
"Bagi yang ingin menjadi cerdikiawan saya me rekomendasikan aplikasi ini untuk segala keperluan kalian, karena hanya aplikasi ini yang bisa pengertian kalah sama doi yang ngambek mulu kerjaan nya:)",753.8705684612,782.4825333697,positif
"Sangat membantu aktivitas keseharian juga pekerjaan baik di dalam maupun luar kota. Antat jemput anak sekolah, antar jemput istri bekerja, layanan go-food manakala sedang di luar kota. Hanya saja memang ada beberapa kali kejadian yg tak menyenangkan seperti driver yg minta pembatalan dg alasan priba...Ulasan LengkapSangat membantu aktivitas keseharian juga pekerjaan baik di dalam maupun luar kota. Antat jemput anak sekolah, antar jemput istri bekerja, layanan go-food manakala sedang di luar kota. Hanya saja memang ada beberapa kali kejadian yg tak menyenangkan seperti driver yg minta pembatalan dg alasan pribadi. Kami dapat memahami bila memang terkadang jarak tempuh dekat sehingga ada penilaian tidak sesuai dg ongkos yg diterima. Kiranya ke depan managemen bisa memberi sistem bagi hasil yg adil dan bijak.",10263.4006588757,12334.9084365728,positif
Sy tdk mau diberi promo B BIRD sopir pilih2 bs2 sy ganti bs 5x krna dibatalkan oleh sopirnya dan kesulitan utk daerah kami jati kramat .sx nya dpt narik kt nya dpt diskon 5rb dan hrus byr 11 - 14 rb ternyata motg saldo gopay sy 28 rb pdhal sy tdk pernah membatalkan BB tsb .pokoknya sy tdk mau diberi...Ulasan LengkapSy tdk mau diberi promo B BIRD sopir pilih2 bs2 sy ganti bs 5x krna dibatalkan oleh sopirnya dan kesulitan utk daerah kami jati kramat .sx nya dpt narik kt nya dpt diskon 5rb dan hrus byr 11 - 14 rb ternyata motg saldo gopay sy 28 rb pdhal sy tdk pernah membatalkan BB tsb .pokoknya sy tdk mau diberi promo BB ok,15417.5771097161,13837.5192463286,positif
"Tolong ya Pihak Grab gojek. 2020 Tombol Cancel di hapus soalnya kasian kalo Di cancel padahal udh susahÂ² di anterin eh pas sampe tujuan di cancel kan kasian juga .jadi supaya tidak ada yg mainÂ² lagi kalo pesan makanan,....tolong respon pihak gojek grab",950.8672793291,831.1858316949,positif
"Aplikasi sangat sangat membantu saya yang kadang malas jalan kaki ,, malaz keluar ,, malaz kena panas ,, malaz kena hujan ,, tinggal klik tinggal tekan semuanya ada di gojek.... Makanan,, minuman,,, pulsanya,,,kuato,, listrik,,game,, sangat sangat keren,,, apalagi skrng ada paylater nya ,, jadi muda...Ulasan LengkapAplikasi sangat sangat membantu saya yang kadang malas jalan kaki ,, malaz keluar ,, malaz kena panas ,, malaz kena hujan ,, tinggal klik tinggal tekan semuanya ada di gojek.... Makanan,, minuman,,, pulsanya,,,kuato,, listrik,,game,, sangat sangat keren,,, apalagi skrng ada paylater nya ,, jadi mudah klu saat tak bawa uang",5745.2928099109,8751.4797759495,positif
"Terimakasih gojek.sukses selalu. Hanya 1 yang masih Mengganjal,pengen nyoba fitur Paylater tapi belum dikasih,semoga aja Kedepanya dikasih.... sukses gjek",156.3398913757,144.5969171807,positif
"Penerapan Penjualan Voucher Discount dirasa Kurang Konsisten, Krn aplikasi ini adalah Aplikasi yg dirasa Berguna & Bermanfaat untuk Kemaslahatan Ummat di Pelosok Tanah Air Tercinta ini, ""Kami Membayar Jasa, Gojek Beramal melalui Voucher Discount"", Terima Kasih Dan Penghargaan Kami kepada CEO GOJEK B...Ulasan LengkapPenerapan Penjualan Voucher Discount dirasa Kurang Konsisten, Krn aplikasi ini adalah Aplikasi yg dirasa Berguna & Bermanfaat untuk Kemaslahatan Ummat di Pelosok Tanah Air Tercinta ini, ""Kami Membayar Jasa, Gojek Beramal melalui Voucher Discount"", Terima Kasih Dan Penghargaan Kami kepada CEO GOJEK Bapak Nadiem Anwar Makarim, B.A., M.B.A., atas ide baiknya dalam Membangun Aplikasi ini, Sukses, Semangat menjalankan Tugas dan Semoga Amanah dalam Membangun Bangsa dibidang Pendidikan 5 tahun kedepan",3342.7016269791,2370.2083176584,positif
"Aplikasi go-jek nya sih bagus yaa, banyak kasih promo. Cuma resto2nya licik yaa, harga dinaikkan biar kesannya kasih diskon besar. Sampe2 harganya macam harga di resto hotel bintang 5, padahal cuma kaki lima. Kenapa sih resto2 cuma ngejar untung semata, gak memikirkan adab jual beli, kejujuran dlm b...Ulasan LengkapAplikasi go-jek nya sih bagus yaa, banyak kasih promo. Cuma resto2nya licik yaa, harga dinaikkan biar kesannya kasih diskon besar. Sampe2 harganya macam harga di resto hotel bintang 5, padahal cuma kaki lima. Kenapa sih resto2 cuma ngejar untung semata, gak memikirkan adab jual beli, kejujuran dlm berniaga. Bahkan kemarin order go-food desc di aplikasi dgn yg datang gak sesuai, bukan cuma jauh dari ekspektasi tapi juga jauh dari yg mereka promokan di aplikasi. Mengecewakan.",9145.4338563406,11184.8760968098,positif
"Ada kutu (bug) di bagian Penampil QR dan Barcode GoPay. Dimana tampilan ""Tenggat waktu QR"" bocor terlihat.",68.7992202687,224.9951931985,positif
