komentar,tfidf_positif,tfidf_negatif,sentimen
"Gojek bagus dan sangat membantu,hanya sayang apabila driver kurang baik respon dalam mengantar makanan dalam gofood dan kita kasi bintang kurang dri 3 bnyk driver yg g trima dan membalas via wa kpd costumer untuk keberatan dan tak sedikit yg marah2 Mohon lebih diperhatikan hal ini,klo memang bagus m...Ulasan LengkapGojek bagus dan sangat membantu,hanya sayang apabila driver kurang baik respon dalam mengantar makanan dalam gofood dan kita kasi bintang kurang dri 3 bnyk driver yg g trima dan membalas via wa kpd costumer untuk keberatan dan tak sedikit yg marah2 Mohon lebih diperhatikan hal ini,klo memang bagus maka akan kita komentar bagus,tetapi apabila layanan kurang memuaskan harap sadar diri dan terima apa adanya",11823.7348539459,13233.9864666355,positif
"Pelayanan bagus,tp tlg kasi note utk bbrp driver kdg helm dan bau badan atau jaketnya agar diperhatikan kebersihannya,utk kenyamanan penumpang...maaf ya.",240.2894638118,286.8237945142,positif
"Saya sangat2 terbantu dengan Gofood,terutama pd saat ibu saya minta sesuatu..gak terbayangkan kl saya hrs keluar d saat g ada kendaraan..dan u Gojek saya merasa terbantu bangeeet..saat mancet,anak les ,plg sekolah kl naik kendaraan umum hrs nunggu lama blm ""ngetemi""nya..wooouu jogek U tBest",1312.5086784455,1985.0659602119,positif
"Top markotop dah gojek! Gua merasa kebantu banget dengan adanya aplikasi gojek. Bisa berpergian walaupun gak ada kendaraan, bisa makan walaupun ada badai hujan wokwok. Drivernya juga kebanyakan ramah"", top dah pokonya aplikasi gojek!",647.2164992899,765.751838594,positif
"Saya sih merasa nyaman aja sama pelayanan nya,kalau masalah makanan nya saya prihatin aja haha,tapi tidak ada hubungannya sama driver nya,iklan penjual nya aja lebay cantik cuman di design wkwkw Thanks buat pelayan nya maju terus Semoga dimurah kan rezeki Aamiin",1524.6249733471,1233.9015650942,positif
"Sgt bermanfaat dan perlu di contoh,,,,belajarlah seperti aplikasi gojek,,selalu bermanfaat buat sesama tanpa membedakan suku serta lainya,,klu kita bs berkarya baik knapa tdk,,,buruan dechhh,,",491.9253479872,415.3886397496,positif
"Sangat aman untuk sy & keluarga, apa lg sy pakai untuk antar anak sekolah... Tingkatkan trs ya kualitas nya...",333.3177588183,359.6213665312,positif
"Baru coba pakek Gojek sih, soalnya ga pernah pakek. Maklum biasa beli sendiri kalo makanan, kalo mau keluar naik motor. Tpi kata temen, bagus"" aja. Trus pernah coba sekali pesen gojek buat berangkat sekolah, dan cepet banget drivernya. Padahal itu udah mepet ke sekolah, kurang 15 menit gerbang ditut...Ulasan LengkapBaru coba pakek Gojek sih, soalnya ga pernah pakek. Maklum biasa beli sendiri kalo makanan, kalo mau keluar naik motor. Tpi kata temen, bagus"" aja. Trus pernah coba sekali pesen gojek buat berangkat sekolah, dan cepet banget drivernya. Padahal itu udah mepet ke sekolah, kurang 15 menit gerbang ditutup. Tapi sampai disekolah dengan goride cuma 10 menit. Pokoknya good lah",6448.6079498194,10020.8158940113,positif
Bagusnya Gojek adalah titik map benar dan akurat. Driver pun sangat BAGUS. Sikap bagus Dan kendaraan baik. Waktu penjemputan Baik,275.1021757798,197.7810025956,positif
Sangat terbantu dengan ada nya aplikasi ini. Semua ada di sini.. ok lahhh... sekedar masukan saja.. kalo bisa tiket pertandingan sepak bola di perbanyak lagi dong... untuk tiket timnas indonesia jarang banget tiket nya di aplikasi ini... Terima kasihhh...,576.1282846658,897.0543337494,positif
"Gojek memang oke, buka lagi dong pendaftaran buat gobox di bandung saya mau jadi mitra, kalo di tutup susah mana driver yang sudah punya kun di jual beli kan lagi,.. Sayang gobox sekarang akun nya jarang yang punya pribadi rata"" Beda orang dikarenakan di jual belikan .. Tolong di atasi masalah terse...Ulasan LengkapGojek memang oke, buka lagi dong pendaftaran buat gobox di bandung saya mau jadi mitra, kalo di tutup susah mana driver yang sudah punya kun di jual beli kan lagi,.. Sayang gobox sekarang akun nya jarang yang punya pribadi rata"" Beda orang dikarenakan di jual belikan .. Tolong di atasi masalah tersebut update lagi driver yang baru dan yang ingin benar"" Jadi mitra yang baik bukan nya di jual belikan akun nya",10085.1553509736,13671.5452561608,positif
"Karya anak bangsa sangat membantu ,ketika kantong tidak bersahabat gojek mempunyai solusi nya dengan vocher vocher yang di bagikannya . Terima kasih GOJEK karena telah menjadi andalan . Karya anak bangsa ( TOP BGT )",575.6053003169,706.3535205453,positif
Saya kasih bintang 5 kalau ada 10 saya kasih 10 dg Yg utama semua nya gak ribet dan gak sulit Pertahankan ya gojek dan gopaynya jangan updete jadi rumit Tidak semua org pandai dlm gadget seperti saya,1145.3788652805,822.5875431477,positif
"saya beli kode google play kok gak bisa di redeem padahal sudah saya setting negara lokasinya ke indonesia, solusinya bagaimana?",106.0532075631,185.2744277007,positif
saran : ke depan fasilitas gosend di tambahkan COD diperuntukkan pedagang online seperti jual baju atau pedagang makanan yg harus pesan 1 hari sebelumnya .. terimakasih,465.8462051353,386.9044647381,positif
"Saya bisnis Jualan pakai gojek Tpi tolong dipandu driver nya donk, masak driver sudah ditunggu malah tiba"" dibatalin dicancel gtu aja. Lah besok nya malah akun saya yg di blokir. Itu namanya memutuskan rezeki org . padahal demi allah saya tdk prnh melakukan penipuan. Tolong dong driver nya dikasih a...Ulasan LengkapSaya bisnis Jualan pakai gojek Tpi tolong dipandu driver nya donk, masak driver sudah ditunggu malah tiba"" dibatalin dicancel gtu aja. Lah besok nya malah akun saya yg di blokir. Itu namanya memutuskan rezeki org . padahal demi allah saya tdk prnh melakukan penipuan. Tolong dong driver nya dikasih arahan",2926.4316662127,3052.8298944764,positif
Selama naik Gojek baik yang roda dua (ride) atau empat (car) alhamdulillah nyaman dan sopirnya bertipe melayani....ok sukses selalu untuk Gojek...Tingkatkan terus pelayanan guna memberi rasa aman dan nyaman kepada pelanggan..,1084.7514815507,791.2582302009,positif
Aplikasi sangat bagus bisa membantu untuk jalan dan juga bisa mengenyang kan perut yang sedang lapar.. terima kasih gojeg sukses terus..,277.6060201655,379.303053555,positif
"Makasih buat aplikasi Gojek udh ngasih harga yg murah banget , knp murah ? Soalnya saya pake Gopay jd bayarnya bisa lebih hemat banget , aplikasi ini cocok banget buat pelajar kaya saya , makasih juga udh ngasih voucher potongan harga jd nya ongkos saya bisa hemat kl sekolahğŸ˜ŠğŸ˜ŠğŸ˜Š.sekali makasih ban...Ulasan LengkapMakasih buat aplikasi Gojek udh ngasih harga yg murah banget , knp murah ? Soalnya saya pake Gopay jd bayarnya bisa lebih hemat banget , aplikasi ini cocok banget buat pelajar kaya saya , makasih juga udh ngasih voucher potongan harga jd nya ongkos saya bisa hemat kl sekolahğŸ˜ŠğŸ˜ŠğŸ˜Š.sekali makasih banyak buat aplikasi Gojek udh ngebantu saya.jangan lupa iya kasih voucher lg buat sayaâ˜º",12668.360269516,9856.8620255853,positif
"App yang sangat berguna dan memudahkan, terutama gofood, bahkan setiap hari istri saya pakai gofood, apalgi kalau pas dapat vocher sehari biaa 3x pesan gofood ğŸ˜…ğŸ˜…",357.9887561804,274.5902730776,positif
"Drivernya sopan baik dan ramah. Pernah hp saya lowbat posisi butuh banget, dan abangnya menawarkan dan meminjamkan power bank, nganter go food juga cepat dan tidak acak acakan, pernah saya ketinggalan rombongan kemudian saya mesan go jek jam setengah 2 malam kemudian gojeknya mau dan percaya padahal...Ulasan LengkapDrivernya sopan baik dan ramah. Pernah hp saya lowbat posisi butuh banget, dan abangnya menawarkan dan meminjamkan power bank, nganter go food juga cepat dan tidak acak acakan, pernah saya ketinggalan rombongan kemudian saya mesan go jek jam setengah 2 malam kemudian gojeknya mau dan percaya padahal tempatnya lumayan rawan... yaa intinya terus begini lah gojek. Sudah sangat saya percayai pelayanannya bintang 5 banget. Trimakasih gojek",8090.805288324,11610.8347632629,positif
Saya menggunakan aplikasi gojek untuk waktu darurat atau tidak ada yang mengantar saya kemanapun saya pergi... Terimakasih gojek dan driver gojek.,112.5579481689,163.7760054238,positif
"Sangat membantu,walaupun pas di waktu kerja qta tinggal pesan gak pkai ribet keluar.sikap driver""nya sll ramah,harga jg terjangkau.pas banget pokoknya.trima kasih gojek,smoga sukses & bisa lbh baik lagi",523.3284404673,545.5469278325,positif
"Aplikasi ini sangat membantu saya untuk pergi , untuk cari makanan (klo lagi gak masak) , dan bisa apa aja dehh.. Jadinya klo lagi pergi kemana gak ada yang jemput pake aplikasi gojek aja deh!!!ğŸ‘ğŸ˜ŠğŸ˜˜ Voucher nya pertama kali saya pake langsung jadi murah harganya!!(di gofood) APLIKASI IS THE BEST G...Ulasan LengkapAplikasi ini sangat membantu saya untuk pergi , untuk cari makanan (klo lagi gak masak) , dan bisa apa aja dehh.. Jadinya klo lagi pergi kemana gak ada yang jemput pake aplikasi gojek aja deh!!!ğŸ‘ğŸ˜ŠğŸ˜˜ Voucher nya pertama kali saya pake langsung jadi murah harganya!!(di gofood) APLIKASI IS THE BEST GUYSS!!ğŸ˜Š",5662.4979852765,5717.7274862273,positif
"Apdetan terbarunya, kamis 28 november kok jelek banget. Langsung masuk buat bikin PIN. Sudah dibikin, diminta masukin OTP tapi OTP gak dikirim2 ke pesan saya, bolak balik diulang2 tetep gak ada kode OTP. Dah telpon CS, katanya gak ada masalah di akun, suruh nunggu trus ngulang, tetep aja gak ada pes...Ulasan LengkapApdetan terbarunya, kamis 28 november kok jelek banget. Langsung masuk buat bikin PIN. Sudah dibikin, diminta masukin OTP tapi OTP gak dikirim2 ke pesan saya, bolak balik diulang2 tetep gak ada kode OTP. Dah telpon CS, katanya gak ada masalah di akun, suruh nunggu trus ngulang, tetep aja gak ada pesan OTP masuk. Nyebelin itu gopay saya masih banyak, aplikasi gak bisa dipakai. Gara2 diapdet jadi gini. Dibalikin kesebelum apdet bisa gak?",7064.7838035685,10687.9738732195,positif
"saya suka aplikasi ini karna sering ada promo dan ongkir nya ga mahal,terus kalau pesan makanan saya gak nunggu lama walaupun tempat nya jauh tapi nyampe nya sesuai waktu yg saya perkirakan,terimakasih gojek,semoga aplikasi ini berjalan dengan baik dan bermanfaat bagi org banyakğŸ™â˜º",1001.2252892181,919.1192168034,positif
"Sudah bagus, cepat dapet drivernya. Hanya saja terkadang saat memesan melalui gofood ada resto yang tulisannya masih buka sejaman lagi namun saat driver sudah sampai di resto ternyata sudah tutup. Untuk itu mohon ditingkatkan lagi mengenai kondisi resto agar sesuai dengan aplikasi. Dan lagi tolong t...Ulasan LengkapSudah bagus, cepat dapet drivernya. Hanya saja terkadang saat memesan melalui gofood ada resto yang tulisannya masih buka sejaman lagi namun saat driver sudah sampai di resto ternyata sudah tutup. Untuk itu mohon ditingkatkan lagi mengenai kondisi resto agar sesuai dengan aplikasi. Dan lagi tolong tambahkan fitur tips bagi orderan gofood yang sudah dicancel. Karena saya merasa ingin memberi driver tips sebagai uang ganti bensin karena sudah sampai di resto, tetapi resto nya tutup. Terima kasih",6307.0110044962,6176.9491551571,positif
"Oke, bagus Kepada pengguna gojek lain,nya bila ada telfon mengatas namakan gojek dengan berbagai modus yang intinya meminta nomor kode sms yg kita terima, mohon untuk jangan pernah dikasih tau, karena itu penipuan untuk membajak akun gojek kita, saya pernah mengalaminya, dan alhamdulillah akun saya ...Ulasan LengkapOke, bagus Kepada pengguna gojek lain,nya bila ada telfon mengatas namakan gojek dengan berbagai modus yang intinya meminta nomor kode sms yg kita terima, mohon untuk jangan pernah dikasih tau, karena itu penipuan untuk membajak akun gojek kita, saya pernah mengalaminya, dan alhamdulillah akun saya aman",4611.7967527816,6117.456665992,positif
Susah login...masa di suru buat email baru..cuman karna no pertama yang saya daftarkan telah hilang..maaf saya uninstal wan .samapai saya di respon,386.3513373974,344.5037178308,positif
"DEAR PARA KONSUMEN. KETIKA ANDA ORDER MAKANAN HARAP KASIH NOTE. DAN KETIKA SAMPAI KEPADA ANDA TERUS PESANAN SALAH KONFIRMASI DULU KE DRIVER. SUPAYA BISA DI TUKAR. JANGAN ASAL RATTING DRIVER. KARNA BUKAN DRIVER YG MASAK ATAU YG SIAPKAN PESANAN. DAN UNTUK DESKRIPSI PRODUK YG ANDA LIHAT DI MENU KONSUME...Ulasan LengkapDEAR PARA KONSUMEN. KETIKA ANDA ORDER MAKANAN HARAP KASIH NOTE. DAN KETIKA SAMPAI KEPADA ANDA TERUS PESANAN SALAH KONFIRMASI DULU KE DRIVER. SUPAYA BISA DI TUKAR. JANGAN ASAL RATTING DRIVER. KARNA BUKAN DRIVER YG MASAK ATAU YG SIAPKAN PESANAN. DAN UNTUK DESKRIPSI PRODUK YG ANDA LIHAT DI MENU KONSUMEN ITU TIDAK MUNCUL DI DRIVER. KETIKA ANDA INGIN DI LAYANI DENGAN BAIK, BELAKU LAH SEPERTI ORANG YG LAYAK DI LAYANI.",0,1227.3926840754,positif
"Alhamdulillah aplikasi Gojek bisa membantu kita semua, semoga aplikasi ini berkah buat driver dan pengguna Gojek lainnya. Terimakasih Gojek!!!!! ""Karya Anak Bangsa"" ğŸ˜˜ğŸ˜˜ğŸ˜˜ğŸ˜˜ğŸ˜˜ğŸ¥°ğŸ˜˜ğŸ˜ğŸ˜ğŸ˜ğŸ¤©ğŸ¤©ğŸ¤©",172.1177181602,172.1177181602,positif
"Tolong Segera di perbaiki masalah di Gopulsa saya mau transaksi pulsa selalu gagal akhir""ini tolong perbaiki...terimakasih.",170.9695478035,130.9194309219,positif
"TOLONG DONG KASIH VITUR ARAH PULANG APA ARAH TUJUAN BIAR DREVER GA KOSONG PAS PULANG,ğŸ™ğŸ™KEMAREN SAYA DI DEPOK JAM 6 SORE NYAMPE 11 MALEM GA DI KASIH ARAH PULANG CUMA MUTER-MUTER DI DEPOK..RUMAH SAYA DI BEKASI. KOSONG DARI DEPOK NYAMPE BEKASI.MAKASI SEBELUM YA",0,445.6500508267,positif
"Bagi para pengguna... Janganlah seenak nya saja memberi rating rendah dan komentar yang ga jelas. Itu sangat merugikan si driver. Jika makanan atau minuman nya kurang bagus atau enak.. beri rating padah toko nya, bukan si driver. Driver hanya menjual jasa, bukan produk. Analogi nya seperti ini; Kepa...Ulasan LengkapBagi para pengguna... Janganlah seenak nya saja memberi rating rendah dan komentar yang ga jelas. Itu sangat merugikan si driver. Jika makanan atau minuman nya kurang bagus atau enak.. beri rating padah toko nya, bukan si driver. Driver hanya menjual jasa, bukan produk. Analogi nya seperti ini; Kepala yang berdarah ehh malah kaki yang diperban ğŸ¤£ğŸ¤£",6468.8568904361,8448.0933900295,positif
Waktu jemputan udah tepat waktu tapi ada yang kurang soalnya saya tidak mengetahui nama kendaraan yang dipakai drivernya tolong dong update lagi biar saya bisa mengetahui nama kendaraan drivernya terimakasih.,372.3748622625,527.0818708216,positif
"Sangat membantu bila pergi jarak pendek,sayangnya untuk lanjut pergi kelain tempat hrs pesan lagi,padahal kita terburu oleh waktu,kenapa tidak ditam program bila mau lanjut dg mobil yg sama. . Mohon bila dalam perjalanan pdrlu mampir, driver jangan cemberut,misalnya mampir atm.",1348.3814229745,1348.3814229745,positif
"Bagus sangat membantu sekali , semoga pelayanannya senantiasa ramah, baik, aman dan nyaman . Aamiin",128.1405227493,128.1405227493,positif
Mantap.... Klw ad komenan dri kastamber jngan langsung di sansi dver yah.... Kasian ad tmen saya ngasih paket di ambil SMA pembantu yah... Pembantu yah lupa ga bilang sama majikan yah... Trus majikan yah NLP ke cs gojek.... Masa langung si sasven dver yah,1439.4561202515,1631.8485419235,positif
Sy suka dengan aplikasi GO-JEK ini karna sangat membantu sy mau kemn2 tdak perlu repot2 lgi pokok nya mau apa aja ada semua di aplikasi GO-JEK terima aksih GO-JEK sukses slalu ya,770.7195182228,660.7293390484,positif
"Saya baru menggunakan GOJEK, menurut saya cukup memuaskan. Dan cukup membantu. Baik dari segi Pelayanan dan penjemputan juga Drivernya. Saya Puas. Smoga kedepannya bertambah baik. Apalagi ini punya anak bangsa, jadikan kita SALUT. Bahwa anak bangsa tercinta ini cukup mampu ğŸ‘ğŸ‘ğŸ‘",1280.0649959765,884.5988264484,positif
"Sejauh ini pelayanannya benar - benar baik. Drivernya ramah, sopan, dan profesional semoga Go-Jek semakin ditingkatkan. Juga jika bisa harganya dikurangi ğŸ‘ğŸ˜",415.7958637276,345.9332078082,positif
"Sangat membantu untuk segala aktifitas, mulai dari bepergian, belanja, membeli makanan, pembelian pulsa,",94.0549188112,96.8061342157,positif
"Selama pake gojek byk suka dukanya ya namanya hidup kaga bisa semau gw, ga ada yg sempurna di dunia ini. Dengan adanya ojol ini sebenarnya membantu kita yg mager, males sendirian bisa ditemenin driver kmn mn, bahkan mau makan aja dianterin makanannya ga perlu ke restoran. Tapi ya kadang dapet driver...Ulasan LengkapSelama pake gojek byk suka dukanya ya namanya hidup kaga bisa semau gw, ga ada yg sempurna di dunia ini. Dengan adanya ojol ini sebenarnya membantu kita yg mager, males sendirian bisa ditemenin driver kmn mn, bahkan mau makan aja dianterin makanannya ga perlu ke restoran. Tapi ya kadang dapet driver yg berbeda karakter ya namanya manusia ga mungkin baik semua ada jg yg cuek, jutek dll. Ya saling perbaiki diri aja antara ojol dan penumpangnya, agar aplikasi ini dpt maju.",12962.4051474033,12945.5107171042,positif
"Download deh app gojek coz gojek karya anak bangsa yg bermanfaat bagi semua kalangan, promo dr gopay juga ga kalah hebat dr app lain. Buat kalian yg cinta dan bangga sm indonesia, download dan gunakan app gojek seperti saya.",1576.7792831022,1220.817726083,positif
"Sangat membantu sekali, apalagi utk ibu2 yang sibuk dirumah nggak sempat keluar, ingin pesan apa saja tinggal klik..udh beres semua",219.2280897947,268.3862554811,positif
"Sangat membantu ...mau antar atau jemput anak tinggal pesan gojek ga perlu capek capek jalan nyari ojek pangkalan , mau berobat atau mau pergi malam tinggal pesan go car ... ..mau makan tapi malas keluar tinggal pesan go food , mau bayar tagihan listrik atau beli pulsa juga pake gopay... Belanja ke ...Ulasan LengkapSangat membantu ...mau antar atau jemput anak tinggal pesan gojek ga perlu capek capek jalan nyari ojek pangkalan , mau berobat atau mau pergi malam tinggal pesan go car ... ..mau makan tapi malas keluar tinggal pesan go food , mau bayar tagihan listrik atau beli pulsa juga pake gopay... Belanja ke Alfamart atau Alfamidi banyak promonya kalau pakai gopay , makasih gojek terus maju tambah sukses....",7966.4629433474,11130.6943359671,positif
sangat membantu buat pergi dan beli makanan.. overall oke kok lebih seneng pake gojek drpd grab.. mapnya akurat jadi jarang nyasar.. semoga setelah update aplikasi makin oke.. Sekarang ada vocer potongan ongkir dan harga juga best banget gofood..,640.5327196607,777.4602560351,positif
Jika ada banyak driver d tempat anda dan anda mendapt driver yg jauh...itu karna driver yg dekat dengan anda sdh tau karakter anda jika anda baik dan menghargai mereka orderan anda langsung d terima... klau anda judes pelit dan suka mampir2 tanpa kasih mereka tip Jadinya males deh terima orderannya....Ulasan LengkapJika ada banyak driver d tempat anda dan anda mendapt driver yg jauh...itu karna driver yg dekat dengan anda sdh tau karakter anda jika anda baik dan menghargai mereka orderan anda langsung d terima... klau anda judes pelit dan suka mampir2 tanpa kasih mereka tip Jadinya males deh terima orderannya.. itu curhatan driver yg sy pernah tanya.. jika anda d untungkan maka jangan merugikan..argo d tambah tip 5rb masih murah dri argo jika anda naik taksi..,17381.3381590812,18166.7216823324,positif
"Sangat membantu. Cuma saran nih, tolong tampilin alasan driver ngebatalin orderan. Keseringan driver udah nerima, udah chat, udah telepon, udah fix mau ambil orderan, tau2 main cancel tanpa info yg jelas. Kan BT jadinya ğŸ¤¦â€â™€ï¸",816.85323037,1011.0060032294,positif
Sangat berguna sangat membantu memudahkan aktifitas sehari2. Dan harganya lebih murah dari kompetitornya. Dan saya dapat vouchernya diskon nya banyaaaaak... Tapi sayang tdk bisa saya pakai...... Karena hrs gopay. Sy tdk pakai gopay. Ini kali ya yg hrz diperbaiki.,1101.4647165677,837.0131292683,positif
"Tolong jangan terlalu sering pembaruan ya, kalo sizenya kecil sih gpp. Oh iya pembayaran linkaja baru bisa di go ride/go car aja ya? Kalo bisa go food juga dong :))",673.5051008901,691.7647628712,positif
"Mohon perhatiannya,kodepromo buat pebgguna lama...karena kita dah pakai.customer lama,alangkah baiknya juga dikasih voucher...",83.8386208727,83.8386208727,positif
Kalian orang Indonesia.. mereka driver bukan babu.. gojek .. sudah ongkos nya murah . Mau minta pelayanan nya VIP hallo . Hargai mereka . Pahlawan di jalanan .. pihak gojek bukan tegas.. tapi pelit sama bonus..,326.8092787191,646.8050206007,positif
"Regesi Band - Korban Alon Alon. app gojek moga lebih lengkap sperti uber dulu, ada tempel PIN ke driver yg lewat. saya klo mou ke tujuan trus balik lagi harus pesan driver lagi, gak bisa langsung PP satu driver",951.0595207749,949.7901803845,positif
Transportasi onlie yg sangat memudahkan saya dlm tujuan perjalanan kemanapun..yg paling seneng tu ada discountnya..ğŸ¤— sampai 90%.. Ada satu hal lagi yg bikin miris dlm layanan gofood..kasian yg suka dapat pesanan fiktif..saran saya sediaakan layanan pembayaran transfer..biar sipembeli mentransfer du...Ulasan LengkapTransportasi onlie yg sangat memudahkan saya dlm tujuan perjalanan kemanapun..yg paling seneng tu ada discountnya..ğŸ¤— sampai 90%.. Ada satu hal lagi yg bikin miris dlm layanan gofood..kasian yg suka dapat pesanan fiktif..saran saya sediaakan layanan pembayaran transfer..biar sipembeli mentransfer dulu sebelum mesan,5337.982723697,4380.0033898245,positif
"Coba buat supaya bisa kirim gambar di chat nya ,kalau mau gosend dll, biar gampang kasih tau lokasinya pas nya dimana. Thanks",209.5525163708,276.5612405047,positif
"Hai ka hp saya kan ilang dan saya ganti hp lalu mau masukkan akun gojek gbsa karna nomer telpnya beda, daftar juga ga bisa krna email saya sudh di pakai di akun yg kemarin, ini gmn ya ka?? Makasih",757.2964427916,1155.6983902762,positif
"Cukup.membantu, tp tolong keamanan data user bisa lebh di perkuat, krn akun gojek istri saya baru saja di bajak, dan penipunya berpura pura nomer istri dpt gopay 2 jt,,,",155.2947583326,492.2544426269,positif
"Secara keseluruhan aplikasi ini memang bagus banget,sekali ada bonus,bonusnya mantepÂ²ğŸ™ Yang saya inginkan adalah biaya administrasinya mohon di gratiskan,karena setiap transfer ke rekening bank,saldo selalu dalam keadaan tidak bulat/pas dengan saldo..",749.2327745264,629.2051064923,positif
"Aplikasi ini terbaik dan fiturnya lengkap dan desain aplikasinya mudah dipakai. Apalagi fitur Paylaternya sangat membantu sekali,,",233.6779762135,146.0167858492,positif
"Aplikasi/jasa ini sangat membantu saya dikala malas keluar untuk beli makanan ğŸ™‚ driver""nya alhamdulillah ramah"" semua",161.9161440323,181.9786445039,positif
Kasih bintang 5 biar baca Pay later hny klik langganan saya tidak sy gunakan sm sekali tiba2 ada tagihan 30 rb ..hati2 yg pake paylater menjebak sy iseng saja pencet langganan eh tau2 ada tagihan..gawat tuh pay later..ambil tuh uang saya kalian makan tuh duit haram..,2401.2388087393,2994.8041870081,positif
"Alangkah baik nya go deals di adakan kembali seperti dahulu,bnyk voucher yg bisa di tukarkan dengan point. Jadi konsumen semngat bertransaksi menggunakan gopay. Terima kasih",355.5687177693,403.2016215179,positif
"Sopan dan santun ketika berkendara...sekalipun belum pernah order...dari pengalaman dijalankan, saya menggunakan aplikasi Gojek...",59.9766421511,126.1749787068,positif
"Salam hangat.... Edisi Ulang Tahun, berikan kado bintang 5 untuk aplikasi Gojek ğŸ‘ğŸ‘ğŸ‘ğŸ‘ğŸ‘ Dengan adanya Transportasi Online jenis baru ini, sangatlah membantu aktivitas keseharian saya. Memudahkan untuk pesan makanan, bayar bulanan. Perbanyak promo2nya ya... Terimakasih",617.0965028319,234.6927490381,positif
Gojek mantul mantap btul klo kita laper tinggal pencet gopud klo kita mau berpergian tinggal pncet poko nya mh hemat dan nyaman sukses trus ya gojek yg sangat membantu kebutuhan kita ini itu mudah pake gijek.. ajah. Mantap bos ku,1256.0047367582,1515.5791444174,positif
"Wow saya pengguna baru bergabung beberapa hari sebelum ini rasanya tidak perlu diantar sama orangtuaku. Mudah dan cepat. Semoga saya bisa konsentrasi dengan aplikasi yg satu ini: -selesaikan mission sehari,seminggu saja -bayar top-up via driver maupun minimarket Terimakasih salam satu aspal Dari ary...Ulasan LengkapWow saya pengguna baru bergabung beberapa hari sebelum ini rasanya tidak perlu diantar sama orangtuaku. Mudah dan cepat. Semoga saya bisa konsentrasi dengan aplikasi yg satu ini: -selesaikan mission sehari,seminggu saja -bayar top-up via driver maupun minimarket Terimakasih salam satu aspal Dari arya aditya Semarang,jawa tengah",4407.3550222741,3840.3304863302,positif
"Kapan gojek hadir di kabupaten Samosir?kalau bisa secepatnya,untuk menunjang parawisata dan perekonomian wisata.",28.8703306827,28.8703306827,positif
"Beberapa kali saya pesan barang melalu Go same day. Saya merasa kecewa lantaran bapak gojeknya kasar dan kurang sopan santun. Entah mungkin karena bapak kelelahan atau bagaimana. Tapi tidak sepantasnya kami sebagai klien yg memakai jasa gojek diperlakukan seperti itu. Tidak perlu marah2 pak, toh say...Ulasan LengkapBeberapa kali saya pesan barang melalu Go same day. Saya merasa kecewa lantaran bapak gojeknya kasar dan kurang sopan santun. Entah mungkin karena bapak kelelahan atau bagaimana. Tapi tidak sepantasnya kami sebagai klien yg memakai jasa gojek diperlakukan seperti itu. Tidak perlu marah2 pak, toh saya meresponnya baik2. Kalau tidak nemu alamat yg dituju lalu marah2, kalau tlp bru 1 belum terangkat dibilang ga diangkat2. Di tlp memotong pembicaraan",7558.7307213137,11134.5319362939,positif
"Aplikasi ini sangat membantu sekali,,driver yg ramah & tanggap.tolong di tingkatkan promo nya untuk pengguna lama khususnya voucher goride & gofoodnya. Thanks",350.9996673418,259.7204860573,positif
